<?xml version="1.0" encoding="UTF-8"?>
<xs:schema xmlns:xs="http://www.w3.org/2001/XMLSchema">
    <xs:element name="equipos">
        <xs:complexType>
            <xs:sequence>
                <xs:element name="equipo">
                    <xs:complexType>
                        <xs:sequence>
                            <xs:element name="jugadores" minOccurs="1" maxOccurs="1">
                                <xs:complexType>
                                    <xs:sequence>
                                        <xs:element name="jugador" maxOccurs="unbounded">
                                            <xs:complexType>
                                                <xs:sequence>
                                                    <xs:element name="nombre" type="xs:string"></xs:element>
                                                    <xs:element name="fechaNacimiento" type="xs:string" ></xs:element>
                                                    <xs:element name="altura" type="xs:double"></xs:element>
                                                </xs:sequence>
                                                <xs:attribute name="numero" type="xs:integer" use="required"></xs:attribute>
                                            </xs:complexType>
                                        </xs:element>
                                    </xs:sequence>
                                </xs:complexType>
                            </xs:element>
                        </xs:sequence>
                        <xs:attribute name="nombreEq" type="xs:string" use="required"></xs:attribute>
                    </xs:complexType>
                </xs:element>
            </xs:sequence>
        </xs:complexType>
    </xs:element>
</xs:schema>